{
  "content_version": "1.0",
  "product_id": "PPL-PELVIC-QUIET-001",
  "source": "factory-generator",
  "generated_at": "2026-08-26T16:08:37.135Z",
  "items": [
    {
      "q": "What is The Quiet Leak?",
      "a": "A Private, Evidence-Based Guide to Understanding and Improving Postpartum Bladder Control Understands it deserves attention, has a safe pelvic-floor progression, knows when to seek professional assessment."
    },
    {
      "q": "Is this medical advice?",
      "a": "No. Educational content - not medical, clinical, or mental-health advice. It does not replace professional assessment or care.",
      "evidence_label": "Educational content informed by practical and lived experience. It is not a substitute for medical, clinical, or mental-health assessment."
    },
    {
      "q": "How do I get it?",
      "a": "Instant digital download. After checkout the system appears in your Swiipt library with read, PDF, and read-aloud formats."
    }
  ]
}
