{
  "content_version": "1.0",
  "product_id": "PPL-NIGHT-SHIFT-001",
  "source": "factory-generator",
  "generated_at": "2026-09-02T22:41:32.435Z",
  "items": [
    {
      "q": "What is Every Night, Just Me?",
      "a": "A postpartum night-coordination system that replaces nightly arguing with a pre-agreed roster, a fairness ledger, and the exact words to make it stick. A written, fair night-shift system both adults follow - so she gets a protected sleep opportunity, and nobody has to ask."
    },
    {
      "q": "Is this medical advice?",
      "a": "No. Educational content - not medical, clinical, or mental-health advice. It does not replace professional assessment or care.",
      "evidence_label": "Educational content informed by practical and lived experience. It is not a substitute for medical, clinical, or mental-health assessment."
    },
    {
      "q": "How do I get it?",
      "a": "Instant digital download. After checkout the system appears in your Swiipt library with read, PDF, and read-aloud formats."
    }
  ]
}
